{
  "id": "subspaces",
  "module": "module-vector-spaces",
  "order": 1,
  "title": {
    "ja": "subspaces",
    "en": "subspaces"
  },
  "summary": {
    "ja": "subspacesを段階的に学ぶための計画Unit。",
    "en": "A planned unit on subspaces."
  },
  "estimated_duration": {
    "reading_minutes": 7,
    "video_minutes": 12
  },
  "concepts": {
    "primary": [
      "subspaces"
    ],
    "supporting": []
  },
  "prerequisites": [],
  "learning_objectives": [
    "subspacesの基本的な意味を説明できる"
  ],
  "content": [
    {
      "type": "planned",
      "body": "このUnitは、subspacesを前提知識から例題・演習へ接続する教材として整備予定です。"
    }
  ],
  "exercises": [],
  "formats": {
    "html": {
      "required": true,
      "status": "planned"
    },
    "pdf": {
      "required": true,
      "status": "planned"
    },
    "video": {
      "required": false,
      "status": "not_planned"
    }
  },
  "evidence": [],
  "visuals": [],
  "remediation": [],
  "status": "planned"
}
