{
  "id": "determinant-definition",
  "module": "module-determinants",
  "order": 1,
  "title": {
    "ja": "行列式の定義",
    "en": "The Determinant"
  },
  "summary": {
    "ja": "性質と効率的計算へつなぐを直観・定義・計算・境界ケースの順に学ぶ。",
    "en": "A complete lesson on The Determinant, connecting intuition, definition, computation, and edge cases."
  },
  "estimated_duration": {
    "reading_minutes": 12,
    "video_minutes": 10
  },
  "concepts": {
    "primary": [
      "determinant-definition"
    ],
    "supporting": [
      "determinant-intuition"
    ]
  },
  "prerequisites": [
    "determinant-intuition"
  ],
  "learning_objectives": [
    "性質と効率的計算へつなぐを定義と具体例で説明できる",
    "性質と効率的計算へつなぐの基本計算を実行し、結果を検算できる"
  ],
  "content": [
    {
      "type": "motivation",
      "body": "なぜ行列式の定義を学ぶのでしょうか。2×2のad-bcは、二つの対応の積を向きの符号付きで引いたもの。高次元では同じ『全ての対応を符号付きで足す』原理になる。 性質と効率的計算へつなぐは、次の計算や応用で同じ問いを何度も整理するための道具です。"
    },
    {
      "type": "prerequisite_recall",
      "body": "前提：determinant-intuition。対象の次元と記号を確認してから進みます。"
    },
    {
      "type": "intuition",
      "body": "2×2のad-bcは、二つの対応の積を向きの符号付きで引いたもの。高次元では同じ『全ての対応を符号付きで足す』原理になる。"
    },
    {
      "type": "formal_definition",
      "body": "n×n行列の行列式は、置換の符号と各行から一つずつ選ぶ積の総和で定義される交代多重線形関数である。"
    },
    {
      "type": "term_by_term",
      "body": "定義を、対象・操作・条件・結論に分けて読みます。小行列展開または置換定義を使い、行・列を固定して項を整理する。定義と計算法を混同しない。"
    },
    {
      "type": "worked_example",
      "body": "例題：A=[[a,b],[c,d]]ならdetA=ad-bc。A=[[1,2],[3,4]]では4-6=-2。 まず条件を確認し、小行列展開または置換定義を使い、行・列を固定して項を整理する。定義と計算法を混同しない。 最後にdet[[1,2],[3,4]]=-2。定義に基づく計算であることを確認する。と解釈します。"
    },
    {
      "type": "counterexample",
      "body": "行列式を対角成分の積だけとしない。余因子展開では符号と小行列を落とさない。"
    },
    {
      "type": "checkpoint",
      "body": "確認問題：性質と効率的計算へつなぐの定義を一文で述べ、例の計算を一行で検算してください。答えの目安はdet[[1,2],[3,4]]=-2。定義に基づく計算であることを確認する。"
    },
    {
      "type": "summary",
      "body": "性質と効率的計算へつなぐは、n×n行列の行列式は、置換の符号と各行から一つずつ選ぶ積の総和で定義される交代多重線形関数である。 重要なのは性質と効率的計算へつなぐを式だけでなく、2×2のad-bcは、二つの対応の積を向きの符号付きで引いたもの。高次元では同じ『全ての対応を符号付きで足す』原理になる。としても読めることです。"
    },
    {
      "type": "connection",
      "body": "次のdeterminant-propertiesでは、このUnitの結果を使って、より複雑な構造を扱います。"
    }
  ],
  "exercises": [
    {
      "id": "determinant-definition-exercise-basic",
      "type": "calculation",
      "difficulty": "basic",
      "question": "性質と効率的計算へつなぐを、定義と具体例を使って説明・確認せよ。",
      "solution": {
        "what_is_asked": "性質と効率的計算へつなぐについて、計算結果だけでなく意味と条件を示す。",
        "concepts": [
          "determinant-definition-exercise-basic"
        ],
        "strategy": "定義を確認し、小さな例へ適用してから結果を検算する。",
        "steps": [
          "問題の対象と記号の次元・条件を確認する。",
          "定義に沿って小行列展開または置換定義を使い、行・列を固定して項を整理する。定義と計算法を混同しない。",
          "具体例としてA=[[a,b],[c,d]]ならdetA=ad-bc。A=[[1,2],[3,4]]では4-6=-2。",
          "最後に境界条件やよくある誤りと照合する。"
        ],
        "why": [
          "定義から計算へ進むと、手順の各操作の意味を説明できる。",
          "検算と境界条件の確認で、形式的な答えと数学的な意味のずれを防げる。"
        ],
        "conclusion": "det[[1,2],[3,4]]=-2。定義に基づく計算であることを確認する。",
        "common_wrong_path": "行列式を対角成分の積だけとしない。余因子展開では符号と小行列を落とさない。"
      }
    },
    {
      "id": "determinant-definition-exercise-meaning",
      "type": "explanation",
      "difficulty": "challenge",
      "question": "性質と効率的計算へつなぐを、定義と具体例を使って説明・確認せよ。",
      "solution": {
        "what_is_asked": "性質と効率的計算へつなぐについて、計算結果だけでなく意味と条件を示す。",
        "concepts": [
          "determinant-definition-exercise-meaning"
        ],
        "strategy": "定義を確認し、小さな例へ適用してから結果を検算する。",
        "steps": [
          "問題の対象と記号の次元・条件を確認する。",
          "定義に沿って小行列展開または置換定義を使い、行・列を固定して項を整理する。定義と計算法を混同しない。",
          "具体例としてA=[[a,b],[c,d]]ならdetA=ad-bc。A=[[1,2],[3,4]]では4-6=-2。",
          "最後に境界条件やよくある誤りと照合する。"
        ],
        "why": [
          "定義から計算へ進むと、手順の各操作の意味を説明できる。",
          "検算と境界条件の確認で、形式的な答えと数学的な意味のずれを防げる。"
        ],
        "conclusion": "det[[1,2],[3,4]]=-2。定義に基づく計算であることを確認する。",
        "common_wrong_path": "行列式を対角成分の積だけとしない。余因子展開では符号と小行列を落とさない。"
      }
    },
    {
      "id": "determinant-definition-exercise-boundary",
      "type": "error_detection",
      "difficulty": "standard",
      "question": "性質と効率的計算へつなぐを、定義と具体例を使って説明・確認せよ。",
      "solution": {
        "what_is_asked": "性質と効率的計算へつなぐについて、計算結果だけでなく意味と条件を示す。",
        "concepts": [
          "determinant-definition-exercise-boundary"
        ],
        "strategy": "定義を確認し、小さな例へ適用してから結果を検算する。",
        "steps": [
          "問題の対象と記号の次元・条件を確認する。",
          "定義に沿って小行列展開または置換定義を使い、行・列を固定して項を整理する。定義と計算法を混同しない。",
          "具体例としてA=[[a,b],[c,d]]ならdetA=ad-bc。A=[[1,2],[3,4]]では4-6=-2。",
          "最後に境界条件やよくある誤りと照合する。"
        ],
        "why": [
          "定義から計算へ進むと、手順の各操作の意味を説明できる。",
          "検算と境界条件の確認で、形式的な答えと数学的な意味のずれを防げる。"
        ],
        "conclusion": "det[[1,2],[3,4]]=-2。定義に基づく計算であることを確認する。",
        "common_wrong_path": "行列式を対角成分の積だけとしない。余因子展開では符号と小行列を落とさない。"
      }
    }
  ],
  "formats": {
    "html": {
      "required": true,
      "status": "authored"
    },
    "pdf": {
      "required": true,
      "status": "source_ready"
    },
    "video": {
      "required": false,
      "status": "not_planned"
    }
  },
  "evidence": [
    "openstax-linear-algebra"
  ],
  "visuals": [],
  "remediation": [
    "determinant-intuition"
  ],
  "status": "audited"
}
