{
  "id": "low-rank-approximation",
  "module": "module-applications",
  "order": 2,
  "title": {
    "ja": "low rank approximation",
    "en": "low rank approximation"
  },
  "summary": {
    "ja": "low rank approximationを段階的に学ぶための計画Unit。",
    "en": "A planned unit on low rank approximation."
  },
  "estimated_duration": {
    "reading_minutes": 7,
    "video_minutes": 12
  },
  "concepts": {
    "primary": [
      "low-rank-approximation"
    ],
    "supporting": []
  },
  "prerequisites": [],
  "learning_objectives": [
    "low rank approximationの基本的な意味を説明できる"
  ],
  "content": [
    {
      "type": "planned",
      "body": "このUnitは、low rank approximationを前提知識から例題・演習へ接続する教材として整備予定です。"
    }
  ],
  "exercises": [],
  "formats": {
    "html": {
      "required": true,
      "status": "planned"
    },
    "pdf": {
      "required": true,
      "status": "planned"
    },
    "video": {
      "required": false,
      "status": "not_planned"
    }
  },
  "evidence": [],
  "visuals": [],
  "remediation": [],
  "status": "planned"
}
