{
  "id": "vector-notation",
  "module": "module-prerequisites-vectors",
  "order": 2,
  "title": {
    "ja": "vector notation",
    "en": "vector notation"
  },
  "summary": {
    "ja": "vector notationを段階的に学ぶための計画Unit。",
    "en": "A planned unit on vector notation."
  },
  "estimated_duration": {
    "reading_minutes": 7,
    "video_minutes": 12
  },
  "concepts": {
    "primary": [
      "vector-notation"
    ],
    "supporting": []
  },
  "prerequisites": [],
  "learning_objectives": [
    "vector notationの基本的な意味を説明できる"
  ],
  "content": [
    {
      "type": "planned",
      "body": "このUnitは、vector notationを前提知識から例題・演習へ接続する教材として整備予定です。"
    }
  ],
  "exercises": [],
  "formats": {
    "html": {
      "required": true,
      "status": "planned"
    },
    "pdf": {
      "required": true,
      "status": "planned"
    },
    "video": {
      "required": false,
      "status": "not_planned"
    }
  },
  "evidence": [],
  "visuals": [],
  "remediation": [],
  "status": "planned"
}
