{
  "id": "matrix-operations",
  "module": "module-systems-matrices",
  "order": 2,
  "title": {
    "ja": "matrix operations",
    "en": "matrix operations"
  },
  "summary": {
    "ja": "matrix operationsを段階的に学ぶための計画Unit。",
    "en": "A planned unit on matrix operations."
  },
  "estimated_duration": {
    "reading_minutes": 7,
    "video_minutes": 12
  },
  "concepts": {
    "primary": [
      "matrix-operations"
    ],
    "supporting": []
  },
  "prerequisites": [],
  "learning_objectives": [
    "matrix operationsの基本的な意味を説明できる"
  ],
  "content": [
    {
      "type": "planned",
      "body": "このUnitは、matrix operationsを前提知識から例題・演習へ接続する教材として整備予定です。"
    }
  ],
  "exercises": [],
  "formats": {
    "html": {
      "required": true,
      "status": "planned"
    },
    "pdf": {
      "required": true,
      "status": "planned"
    },
    "video": {
      "required": false,
      "status": "not_planned"
    }
  },
  "evidence": [],
  "visuals": [],
  "remediation": [],
  "status": "planned"
}
