{
  "id": "gaussian-elimination",
  "module": "module-systems-matrices",
  "order": 3,
  "title": {
    "ja": "ガウス消去法",
    "en": "Gaussian Elimination"
  },
  "summary": {
    "ja": "アルゴリズムと解釈を結び付けるを直観・定義・計算・境界ケースの順に学ぶ。",
    "en": "A complete lesson on Gaussian Elimination, connecting intuition, definition, computation, and edge cases."
  },
  "estimated_duration": {
    "reading_minutes": 12,
    "video_minutes": 10
  },
  "concepts": {
    "primary": [
      "gaussian-elimination"
    ],
    "supporting": [
      "matrix-operations"
    ]
  },
  "prerequisites": [
    "matrix-operations"
  ],
  "learning_objectives": [
    "アルゴリズムと解釈を結び付けるを定義と具体例で説明できる",
    "アルゴリズムと解釈を結び付けるの基本計算を実行し、結果を検算できる"
  ],
  "content": [
    {
      "type": "motivation",
      "body": "なぜガウス消去法を学ぶのでしょうか。各列の下にある係数を0にして、未知数の依存関係を階段状に露出させる。見た目を変える操作ではなく、解集合を保つ操作である。 アルゴリズムと解釈を結び付けるは、次の計算や応用で同じ問いを何度も整理するための道具です。"
    },
    {
      "type": "prerequisite_recall",
      "body": "前提：matrix-operations。対象の次元と記号を確認してから進みます。"
    },
    {
      "type": "intuition",
      "body": "各列の下にある係数を0にして、未知数の依存関係を階段状に露出させる。見た目を変える操作ではなく、解集合を保つ操作である。"
    },
    {
      "type": "formal_definition",
      "body": "ガウス消去法は、行交換・非零行のスカラー倍・他行の倍数加減という可逆な行操作で連立方程式を簡約する方法である。"
    },
    {
      "type": "term_by_term",
      "body": "定義を、対象・操作・条件・結論に分けて読みます。拡大係数行列を作り、左からピボットを選び、下を0にし、最後に後退代入する。零行や交換不能なピボットも確認する。"
    },
    {
      "type": "worked_example",
      "body": "例題：x+y=3, 2x+3y=8の拡大行列でR2←R2-2R1を行うと[0,1|2]、よってy=2,x=1。 まず条件を確認し、拡大係数行列を作り、左からピボットを選び、下を0にし、最後に後退代入する。零行や交換不能なピボットも確認する。 最後に解は(1,2)。各行操作が解集合を保つ理由を一つずつ説明する。と解釈します。"
    },
    {
      "type": "counterexample",
      "body": "ピボットが0なら行交換を試す。全係数0=非零定数の行は解なし、零行は冗長な条件を示す。"
    },
    {
      "type": "checkpoint",
      "body": "確認問題：アルゴリズムと解釈を結び付けるの定義を一文で述べ、例の計算を一行で検算してください。答えの目安は解は(1,2)。各行操作が解集合を保つ理由を一つずつ説明する。"
    },
    {
      "type": "summary",
      "body": "アルゴリズムと解釈を結び付けるは、ガウス消去法は、行交換・非零行のスカラー倍・他行の倍数加減という可逆な行操作で連立方程式を簡約する方法である。 重要なのはアルゴリズムと解釈を結び付けるを式だけでなく、各列の下にある係数を0にして、未知数の依存関係を階段状に露出させる。見た目を変える操作ではなく、解集合を保つ操作である。としても読めることです。"
    },
    {
      "type": "connection",
      "body": "次のrref-and-pivotsでは、このUnitの結果を使って、より複雑な構造を扱います。"
    }
  ],
  "exercises": [
    {
      "id": "gaussian-elimination-exercise-basic",
      "type": "calculation",
      "difficulty": "basic",
      "question": "アルゴリズムと解釈を結び付けるを、定義と具体例を使って説明・確認せよ。",
      "solution": {
        "what_is_asked": "アルゴリズムと解釈を結び付けるについて、計算結果だけでなく意味と条件を示す。",
        "concepts": [
          "gaussian-elimination-exercise-basic"
        ],
        "strategy": "定義を確認し、小さな例へ適用してから結果を検算する。",
        "steps": [
          "問題の対象と記号の次元・条件を確認する。",
          "定義に沿って拡大係数行列を作り、左からピボットを選び、下を0にし、最後に後退代入する。零行や交換不能なピボットも確認する。",
          "具体例としてx+y=3, 2x+3y=8の拡大行列でR2←R2-2R1を行うと[0,1|2]、よってy=2,x=1。",
          "最後に境界条件やよくある誤りと照合する。"
        ],
        "why": [
          "定義から計算へ進むと、手順の各操作の意味を説明できる。",
          "検算と境界条件の確認で、形式的な答えと数学的な意味のずれを防げる。"
        ],
        "conclusion": "解は(1,2)。各行操作が解集合を保つ理由を一つずつ説明する。",
        "common_wrong_path": "ピボットが0なら行交換を試す。全係数0=非零定数の行は解なし、零行は冗長な条件を示す。"
      }
    },
    {
      "id": "gaussian-elimination-exercise-meaning",
      "type": "explanation",
      "difficulty": "challenge",
      "question": "アルゴリズムと解釈を結び付けるを、定義と具体例を使って説明・確認せよ。",
      "solution": {
        "what_is_asked": "アルゴリズムと解釈を結び付けるについて、計算結果だけでなく意味と条件を示す。",
        "concepts": [
          "gaussian-elimination-exercise-meaning"
        ],
        "strategy": "定義を確認し、小さな例へ適用してから結果を検算する。",
        "steps": [
          "問題の対象と記号の次元・条件を確認する。",
          "定義に沿って拡大係数行列を作り、左からピボットを選び、下を0にし、最後に後退代入する。零行や交換不能なピボットも確認する。",
          "具体例としてx+y=3, 2x+3y=8の拡大行列でR2←R2-2R1を行うと[0,1|2]、よってy=2,x=1。",
          "最後に境界条件やよくある誤りと照合する。"
        ],
        "why": [
          "定義から計算へ進むと、手順の各操作の意味を説明できる。",
          "検算と境界条件の確認で、形式的な答えと数学的な意味のずれを防げる。"
        ],
        "conclusion": "解は(1,2)。各行操作が解集合を保つ理由を一つずつ説明する。",
        "common_wrong_path": "ピボットが0なら行交換を試す。全係数0=非零定数の行は解なし、零行は冗長な条件を示す。"
      }
    },
    {
      "id": "gaussian-elimination-exercise-boundary",
      "type": "error_detection",
      "difficulty": "standard",
      "question": "アルゴリズムと解釈を結び付けるを、定義と具体例を使って説明・確認せよ。",
      "solution": {
        "what_is_asked": "アルゴリズムと解釈を結び付けるについて、計算結果だけでなく意味と条件を示す。",
        "concepts": [
          "gaussian-elimination-exercise-boundary"
        ],
        "strategy": "定義を確認し、小さな例へ適用してから結果を検算する。",
        "steps": [
          "問題の対象と記号の次元・条件を確認する。",
          "定義に沿って拡大係数行列を作り、左からピボットを選び、下を0にし、最後に後退代入する。零行や交換不能なピボットも確認する。",
          "具体例としてx+y=3, 2x+3y=8の拡大行列でR2←R2-2R1を行うと[0,1|2]、よってy=2,x=1。",
          "最後に境界条件やよくある誤りと照合する。"
        ],
        "why": [
          "定義から計算へ進むと、手順の各操作の意味を説明できる。",
          "検算と境界条件の確認で、形式的な答えと数学的な意味のずれを防げる。"
        ],
        "conclusion": "解は(1,2)。各行操作が解集合を保つ理由を一つずつ説明する。",
        "common_wrong_path": "ピボットが0なら行交換を試す。全係数0=非零定数の行は解なし、零行は冗長な条件を示す。"
      }
    }
  ],
  "formats": {
    "html": {
      "required": true,
      "status": "authored"
    },
    "pdf": {
      "required": true,
      "status": "source_ready"
    },
    "video": {
      "required": false,
      "status": "not_planned"
    }
  },
  "evidence": [
    "openstax-linear-algebra"
  ],
  "visuals": [],
  "remediation": [
    "matrix-operations"
  ],
  "status": "audited"
}
